q,a
How can change gas to solid?,"Changing a gas to a solid is dependent on one crucial thing; the material in question! For example, with steel that is in a gaseous state, which requires a substantial and extreme amount of heat {around 3000 Kelvin in the most heat-tolerant ores), needs only a cooling agent to turn directly from gas to solid. This process is primarily done with liquid iron, rather than vaporeal iron, but the idea still is relevant. That process is what allows us to produce ball bearings and mold things.    There is of course the second method, which is how ""liquid"" propane stays a ""liquid"", even though it boils quite well below the freezing point of water. That method is pressurization. A very large volume of gas is placed into a reinforced container. This container squeezes that great volume into such a small area, the gas acts like a solid; clumping together, even though under normal pressure, it would be floating into neverland. This method works for organic gases and fluids; like butane lighters and propane grills, that boil below temperatures humans are comfortable in. 		"
What is it called when solids change to gas?,A phase change from solid directly to gas is called sublimation. A common example of sublimation is that of dry ice (solid carbon dioxide). 		
Does the volume changes when liquid changes to solid?,"Usually, yes. Most of the time the solid form is denser and therefore occupies a smaller volume than the liquid, but for a few substances the reverse is true. 		"
How does a solid change to a liquid in science?,"Solid changes to liquid when a substance reaches it's melting point. For example, water's melting point is 0 degree celcius. 		"
How can something change from a liquid to a solid?,I think you mean the freezing point. The freezing point of water is 32 degree's Fahrenheit. 		
What is changes in solid liquid and gas?,"The change between solid, liquid and gas is known as a change of state and is affected by the substance and its temperature.  E.g. at room temperature water is liquid but a 0 o c it becomes ice, a solid. 		"
Why does mass not change when solid is melted?,"Mass is the amount of 'stuff' that a thing has, so assuming thatwhen you melt a solid part of it isn't vaporised, then the amountof stuff remains the same, even if it's changed it's form.  Mass is measured by weighing a thing within a gravitational field(with no other forces acting on it), not volume or shape. 		"
,
Where can you find answers to your science questions?,"Generally, the best place to find the answers to your Science questions is by looking in the related textbook. You should also look at any class notes you have taken or any handouts from the class or at any websites that may have been given to you by the teacher.    You can also look in a library or on science related websites.    On Answers.com, you can ask your science question by typing it in the Answers box at the top of the page, check to see if there is the same or similar question that has already been answered or wait for someone to answer your question. 		"
Who discovered answers to a lot of science?,"Benjamin Franklin was the first to discover s to many scientific questions, like ""where did lightning come from?"" 		"
What questions can be answered by science?,"quatifiyable ones. any question which can be answered with a number.. 
Hypothesis is something that we use science to back up. 		"
What are the answers to the millsberry science competition?,1.b 2.c 3.a 4.a 5.a 6.c 7.c 8.a 9.b 10.b 11.b 12.c 13.b 14.a 15.a 16.b 17.b 18.d 19.d 20.c 21.b 22.b 23.b 24.d 25.b 26.a 27.b 28.a 29.b 30.b 31.c 		
Where do you find science answers?,"You can find scientific answers in the Science category.  Simply go to the home page, and go to the middle of the page and click the 'Browse our ... categories'.  Then, type in Science, and then hit 'Go'.  You should be led to the science category. 		"
What are the challenges when teaching science in preschool?,"Challenges in school period. For one thing there is a lack of knowledge. Teachers especially in elementary schools do not have the direct training required for higher levels of science education. Many teachers do not feel comfortable teaching science and are very unsure of how to go about teaching science even though many schools are adopting programs that come with all the guided material necessary to provide students with hands on concrete experiences. Another probelm is the stress of the No Child Left behind act. This act and the mandates thereof leave both administrators and teachers alike stressed to make sure that all the required material that will be presented on the standardized test will be covered. If the school does not make AYP (average yearly progress) funding will be cut and over a period of time if the school continues not to make AYP a revamping process for that school will occur and parents will have an option of legally transferring there children to other schools. As far as preschool just coming up with creative fun hands on age appropriate activities can be a challenge. There are many books that you can borrow from the library that outline different experiments,etc. for school aged children. Simplicity is the key but still allowing preschoolers to explore and understand the world around them. An example is floating. Putting a raw egg in water and an hard boilded egg and having the students perdict which one will float. There are others that I cannot think of right now but teaching science in preschool is not as hard as one would think. Just talking about plants, animals, magnets, electricity, gravity, etc. is all science related and relevant for when they reach kindergarten on up. D. Middleton First Grade Teacher/Biologist 		"
What are the answers for the formula challenge work sheet?,How can I know the acceleration if I hit a speed of 50 m/s after 5seconds 		
Answers to UK intermediate mathematical challenge?,You have not specified a year but below is a link to a list of the last several years answers. However if you want this years it may be more tricky.    Hope I've helped :) 		
Where can you get answers to your science workbook?,"Generally, the best place to find the answers for a Science workbook or any workbook is by looking in the related textbook. You should also look at any class notes you have taken or any handouts from the class or at any websites that may have been given to you by the teacher. 		"
Does science have all the answers?,well there are lots of opinans and mine is that yesss it does because whatever question it is there is still a bit of science in it it may not be all science but of course there willl be some or maybe's 1/4. 		
Captain rhubarb challenge answers?,Just open a second tab in your browser. Then Google the questions. You don't have a time limit to answer so you can take your time doing the research. That's how I got through it. 		
What are the answers for the pi day challenge?,"Pi is 3.141592 For the first problem:  There is a balloon holding up the Pi sign. Click the balloon to pop the balloon. Click the clock to continue.  For the second problem: Drag the beads into the arc in the order of the rainbow starting with red. AKA red orange yellow green blue purple violet  For the third problem: This is difficult. You need to know the day of pi. Saturday march 14, 1592. 		"
What are the answers to the LEGO Trivia Challenge?,"It has 5 questions. The questions are-. 
1. In the Lego Star Wars comic featured in the March issue of Lego Club Magazine and Lego Brickmaster Magazine, who gives Anakin his first clue about the location of the missing R2-D2?. 
2.What does the Power Miners Crystal Sweeper use to excavate crystals?. 
3. What is the name of the new online game on BIONCLE.com?. 
4. What did the monkey hide on Brickbeard's ship?. 
5.what is the name of the Lego Club mascot who introduces the magazine each month? 		"
Which of these questions cannot be answered by science?,Questions without any scientific support may not be answered by science. Hope this helped :3 		
What are the answers to Samora's Science Challenge on HorseIsle?,"1. Neptune   2. Hydrogen   3. 1000   4. Spruce   5. Lakes   6. Parrot   7. Neutrol   8. Warmer because it emits more heat while cooling the fridge down   9. Pumice   10. Blue. 
From Tinggu server brown 		"
Where can you find answers to science questions?,"wiki answers.com can answer most of the questions but there aresome questions wikianswers cant find. ======= Just like solving any other kind of problem: Use the informationyou're given, along with your life experience, your knowledge of the subject, newresearch, and your brain, to derive the information not given. 		"
What are the answers to celestria's challenge?,1) the imaginary number i 2) another location 3) buddhism 4) roman gods 5)neutrons in a molecule 6) lion goat and snake 7) single elite 8) sadism and masochism 9) get   THIS IS TRUE!! 		
What are the answers to Udon and Moegi's challenge?,"You can take Udon and Moegi's challenge as many times as you needto. The best strategy is to write down the answers that you giveeach time. Circle the answers that you get right, and check theones that you get wrong. This way, you will have a record of yourwrong guesses and can continue guessing until you get the rightanswer. 		"
Is computer science a challenging subject for people?,"As with all other subjects, some people will learn topics in computer science very easily while others struggle with the very same topics. 		"
Forensic science a to z challenge?,Answers A- Arson B-Blood C-Crime Scene D-Detective E-Eyewitness F-Footprint G-Gunshot Residue H-Hairs I-Innocent J-Jury K-Kidnapping L-Laws M-Microscope N-Noses O-Observation P-Polygraph Q-Questions R-Ridge S-Sketch T-Trace U-Ultraviolet V-Verdict W-Wound X- X-ray Y- Y-chromosome Z-Zero  By-Lily :) 		
What kinds of questions can be answered by science?,"Science can only answer questions of the phenomenal universe, meaning those phenomena that can be observed and subjected to testing and possible falsification. Science cannot address the supernatural since, by definition, the supernatural goes beyond the natural world and is not subject to the laws and theories determined by science. Science also cannot address metaphysical questions since, also by definition, these questions address matters beyond those that can be subject to scientific scrutiny. 		"
What is science olympiad junckyard challenge?,"you use many objects to create a device that will set off 4 mousetraps in a specific order, north, south, east, and west. You must be able to fit every prop into a clear, specific size box. go to the science olympiad webpage for more info. 		"
Answers for the mathematical challenge 2009-2010?,"Unfortunately you CANNOT ask for answers for this mathematical challenge, it is against the rules. 		"
Where can you get the answers to the Earth Science workbook?,"Generally, the best place to find the answers for an Earth Science workbook or any workbook is by looking in the related textbook. You should also look at any class notes you have taken or any handouts from the class or at any websites that may have been given to you by the teacher.    You could also ask another student in the class for help in finding the answers. 		"
What are the answers for the element challenge puzzle?,There are many levels involved i the Element Challenge puzzle game.Clues and hints for the levels are available to help playersdetermine the solutions. 		
Where can you find the answers to geobee challenges?,"when you take the challenges you will have 10 questions and 3 answers to choose from. In intermediate you will have 2 chances to guess the right answer. if your guess the right answer there will be a green sign that appears. If you don't guess the right answer then the one you didn't pick will be the correct answer. if you do the expert, you will only have one choice. so you will just have to go through twice, since you can do that, and pick different answers each time if you get them wrong.    if you don't like going the hard way for the expert, it says the correct answer in the corner of both levels 		"
What are the answers to the 7 cups challenge?,"Circumference of the dial is 40.82, round it to 41. (3.14 x 13)  3/4 of 41 (41 x 0.75) = 30.75 		"
The answers to Physical Science IF8767?,Seeking the answers to the Psychological Science IF8767 online willnot provide a person with the answers. They will need to look overthe books from the course to know the answers. 		
What are the answers for junior maths challenge 2010?,I am  a three digit number. all of my digit is multiples of 2. my hundreds digit is the lowest even number. the sum of my digits is 16. the units digit is the same as the difference between my hundreds and tens digits. 		
Which question can be answered by science?,how much pesticide is safe to use on plants what is the effect of pesticides on the environment how much energy does it take to make a paper bag 		
Where to get answers for science dimensions 1?,"If you wish to know about the names and types of science dimensions, then have a crack at SI Units in Wikipedia.org 		"
What are the answers to what is science work sheet?,try visiting the website and going to the teachers section ( if there is one) 		
What are the answers for the element challenge word search?,"In word search, many letters are scrambled around inside a box, with hidden words that make sense scattered inside. Usually, there will be a list of all the hidden words you need to find. To play word search, you must find every word in the list and cross the words out in the box. words can go up, down, diagonally across, through each other, and backwards in a regular game of word search, but some may change the rules when they create their game. 		"
Is there a question that cannot be answered that doesnt have to do with science?,"Basic paradoxes are examples of questions that cannot be answered. For example, what happens when an immovable object meets an unstoppable force? Since neither an immovable object nor an unstoppable force exist in reality, there is no way to determine what would happen in this theoretical situation.  Source: personal experience 		"
What are the answers for junior maths challenge 2011?,"(I don't know the answers either!) . 
GG: I got it on Monday, and i dont hav many answers (all J3, all J2, A:J1), but they're not that hard if u sit down 4 1/2 hour 4 some, and 4 others u can just google, ive found lots of hints, but not really answers. 		"
What are the answers Marlboro snus challenge?,"6 spit free . 
any will work   . 
just mark anyone . 
30 min . 
crazy   . 		"
What are the answers to IF8728 challenge your mind?,"This was a total hassle, so here is some help- this is nothing more than a teacher's way to waste learning time!    pencils   notepaper   lunch money   felt tip pen   sweat shirt   folders   house key   gym clothes   calculator   backpack   markers   chewing gum   new jeans   notebooks   can of soda 		"
How do you get your answers and are they backed up by science?,"I can only speak for myself, but the answers I give are researched with an encyclopedia or industrial printed sources. I frequently check the answers given by other contributors, and (not too often) I'll draw to their attention if I see an error.    Other stuff comes from simple reference material, such as 'A Table of Isotopes' or ' the Field Guide to New Zealand Birds' or Smithsonian Physical tables'. 		"
Explain the statement science answers the why and technology answers the how?,The statement is basically saying:   Science tells you  why  things work Science deals with the theoretical principles.   Technology tells you  how  to make things work.Technology deals with the practical application of the theory and sometimes succeeds by trial and error if the theory is not known. 		
What challenges does science give to religion?,"This depends on your point of view. As a Christian, to me,  none . Science will eventually catch up. Years ago, the Earth was the center of the Universe, and everything revolved around the planet. The Earth was flat. Science is catching up with the truth.    God's word never changes.  Things that we didn't understand in the past, was all put down to the acts of God. As we understand the mechanics of how things work, this appears to remove the powers of God, which can be very upsetting to those who have hung their faith on everything. However, there is room for God in our modern living. Evolution, is the tool that God uses for creation. 		"
What is the Big Z challenge?,Which game is it from? You don't get answers about a game until you tell which game. 		
Where do you get answers for Holt science worksheets?,"looking for answers to McGraw hill reinforcement worksheet for chapter on forces, Newton's 3rd law 		"
What are the Australian maths challenge 2012 answers?,"If you've been keeping up with your work, then it shouldn't be too difficult   for you to work out the answers on your own.    You see, the ' challenge ' is in devising a method to solve each exercise.   If you're given the answer, the 'challenge' is ruined. I would not do that   and spoil it for you. 		"
What are the challenges facing science teacher in Tanzania?,Lack of materials to access them to teach student properly.    lack of fund is another problem facing science teachers    in Tanzania    Poor student attendance at school enable difficult for teacher to analysis the understanding capacity of her student. 		
How has the growth of science and secularism challenged Christianity?,"During the medieval period, Christianity was, in Europe, the only available explanation of how the universe works or what anything means. Science and secularism offer alternatives, in the modern world. For example, there is a constant debate between creationism and evolution, concerning the origin of life on Earth. 		"
Where can you get the answers for your Life Science workbook?,"Generally, the best place to find the answers for a Life Science workbook or any workbook is by looking in the related textbook. You should also look at any class notes you have taken or any handouts from the class or at any websites that may have been given to you by the teacher.    You could also ask another student in the class for help in finding the answers. 		"
What are the answers to if8722 challenge your mind 5.7?,I don't have that in front of me. Perhaps you could give me one of the problems. 		
What is the mystery word to the forensic science a to z challenge?,This is something you will have to play the game to figure out.This will be a part of the challenge to figure out the keyword. 		
What are the answers for the junior maths challenge 2013?,There are several websites that will help you cheat on homework   and study assignments. This site is not one of them. 		
What challenges does religion give to science?,"Before answering, it should be pointed out that some religiousadherents do not question what scientific consensus says. In thatcase, there isn't much direct challenge. But there are other religious adherents who maintain the traditionthat God created animal species without the process of evolution.This belief challenges the belief in evolution, in that it goeshand-in-hand with questioning evolution and making an effort topoint out its flaws, contradictions, tautologies etc. The above is a central example (see also its Related Link, attachedbelow), but there are other examples. Religious adherents havebeliefs concerning the soul, the afterlife, mankind's purpose,etc., that may be seen as calling the worldview of many scientistsinto question. 		"
,
Ano ang pinaka maliit na isda sa pilipinas?,"Pandaca pygmaea . 
Pandaca Pygmea  - may habang 9.6 milimetro, halos kasinlaki ng isang butil ng bigas. . 
Tabios  - may habang 3 hanggang 4 milimetro ay natatagpuan sa Lawa Lake Buhi sa Camarines Sur. 		"
Ano ang kaibahan ng pagtuturo sa urban at rural na paaralan?,"Ang lahat ng nakasulat dito ay basi lang po sa aking nalalaman : para sa akin ang kaibahan ng pagtuturo sa urban at rural ay mas matututruan ng husto ang mga mag aaral sa urban dahil kumpleto ito sa gamit may kompyuter, may kumpletng libro. Pero karamihan po sa mga mag aaral ay kadalasan ay Hindi nag aaral ng mabuti , bulakbol , marami ang walang respeto sa mga guro. At bawat subject iba iba ang guro pero sa probinsya iisa lang ang guro pero maayos ang lahat mas matuturuan ang mga estudyante dahil may maraming trabaho at napakalaking lupang sakop ng eskwelahan , kulang sa kagamitan at mga dalubhasa na guro . Pero kahit rural ka man o urban nabibilang nasa estudyante lang yan nakabase ang lahat kailangang magsikap at mag aral mabuti kahit kulang sa kagamitan, kumpara sa kumpleto ang kagamitan pero tamad ang mga estudyante . 		"
Ano ang na impluyensa natin sa mga orang dampuan?,"sila ang nagtatag ng pook-kalakalan sa Sulu.Ang mga sentrong ito ng kalakalan sa pagitan ng mga taga-Sulu na tinatawag na Buranun at mga tao mula sa   Champa,Vietnam. 		"
Ano ang aral na mapupulot sa noli?,Na dapat nating pahalagahan ang ating bansa at maging mapagmatyagsa mga nangyayari sa ating paligid. 		
Ano ang pinakamagandang bansa sa buong mundo?,Switzerland - kasi dito kadalasan nanggagaling ang mga gatas nainimport at export sa ating bansa. marami ka ring mgamagagandang lugar na makikitadito.napapanatili rin nilang at maayosmaganda ang kanilang lugar.ito rin ay isa sapinakamayamangbansa. 		
Ano ang mga sukat ng bawat kontinente ng mundo?,"1. Asya - 44,579,000 kmÃÂ² (17,212,000 sq mi)  2. Hilagang amerika - 24,709,000 kmÃÂ² (9,540,000 sq mi)  3. Timog amerika - 17,840,000 kmÃÂ²  4. Europa - 10,180,000 kmÃÂ² (3,930,000 sq mi)  5. Aprika - 30,221,532 kmÃÂ² (11,668,598.7 sq mi)  6. Australia - 7,686,850 km2 (2,967,909 sq mi)  7. Antartika - 1,250,257.6 km2 (482,727.2 sq mi) 		"
Anu ano ang mga Akdang pampanitikan na nakaimpluwensya sa daigdig?,mga akdang nakaimpluwensya sa panitikan ng daigdig:   1.banal na kasulatan   2. Koran   3.Iliad at Odyssey   4.Mahabharata   5.Divina Commedia   6.El Cid Campeador   7.Awit ni Rolando   8.Aklat ng mga Araw   9.Aklat ng mga Patay   10.Sanlibo't isang Gabi   11.Centerbury Tales   12.Uncle Tom's Cabin ni Harriet Beecher 		
Bakit iba't iba ang hugis ng kontinente sa mundo?,ang hugis ng kontinente sa mundo ay iba iba may malaki iba din aymaliit lamang na kontinente 		
Anu-ano ang mahahalagang detalye na matatagpuan sa mapa at globo?,ang mahalagang nakikita na detalye na matatagpuan sa mapa at globo ay potang ina mo hayop ka gago ka mamatay na gumawa ng site na ito nag hahanap nga ng sagot eh potang ina nyo   tama! putang ina nitong site na to!!!! ang panget ng mga sagot!! gago! ako nga pala si shoneng 		
Anu-ano ang mga katubigan na nakapaligid sa pilipinas?,Ang pilipinas ay napapaligiran ng mga sumusunod...  silangan: karagatang pasipiko (pacific ocean)  kanluran: dagat tsina (china sea) timog: dagat celebes (celebes sea)  hilaga: tsanel balintang (balintang channel) 		
Ano ang dalawang salita na bumubuo sa history?,ang dalawanga bumubuo ng history ay ang sibika at kasaysayan ang mga ito ang bahagi ng mundo kung saan ang pilipinas ay nang galing roon sa historyang iyon 		
Ano Ang Kahalagahan ng Tao Sa Mundo?,Ang kahalagan ng tao sa mundo ay kapag walang tao walang mag-aalaga sa nilikha ng diyos. 		
Ano ang mga salitang Filipino na walang katumbas sa English?,"Mga salita ng Filipi  no   na wala  ng katumbas sa E  nglish ay saya  ng, po, opo, ho, oho, gigil, kilig. . 		"
Ano ang mga salik na nakakaapekto sa panitikang filipino?,"Lipunan at Pulitika . 
Klima o Panahon . 
Relihiyon/Pananampalataya at Edukasyon . 
Hanapbuhay . 
Pook o Tirahan   thanks... :) 		"
Ano ang pananaw mo sa kahulugan ng tunay na tagumpay?,"ang tunay na tagumpay sa buhay ay hindi nasusukat at nababatay kung anung mayroon tayo ngayon, kung nagtagumpay man tayo sa trabaho, sa pag ibig o ano pa mang bagay na pinagwagian natin. dahil ang tunay na tagumpay ng buhay ay makakamit lamang kung magiging kuntento tayo sa mga bagay na ipinagkaloob sa atin ng diyos... at higit sa lahat ang pagpapakatotoo sa ating buhay...... 		"
Ano na ang nangyayari sa ekonomiya ng bansa ngayon?,nagkakalabuan na dahil sa mga pulutika at yun na yun dahil sa mga korapsyon at tama na dahil hindi ko na ala thank u nawa'y makatulong ako 		
Ano ang mga likas na yaman sa hilagang asya?,"Hilagang Asya   KyrgyzstanTajikistan- mineral na panggatong, pang-industriyal (phosphate), metaliko (ginto)  Uzbekistan- ginto at cotton seed (#1 sa mundo) Turkmenistan- natural gas   . 
Cotton seed . 
Lambak-ilog . 
Pag-aalaga ng hayop 		"
Ano ang tunay na hugis ng mundo?,"ang mundo ay hindi bilog kundi ang gitna nito ay paumbok at sa magkabilang dulo ay patag. Ito ay tinatawag sa wikang Ingles na hugis na ""oblate spheroid"". 		"
Ano ang mga salitang Filipino na walang katumbas sa Ingles?,"Mga salita  ng Filipi  no   na wala  ng katumbas sa I  ngles ay saya  ng, gigil, kilig, po, opo, ho, oho.   . 		"
Anu ano ang apat na kontinente?,"Hindi po apat ang ating kontinente kundi..7...kinabibilangan ito ng asya, Africa, north America, south America, Antarctica, Europe at panghuli ay ang Australia... 		"
Paano nabuo ang pitong kontinente ng mundo?,"First, it is pangaea, malaking kontinente, iisa lang siya,   next is tectonic movement at yung nag tagal na nag continental drift na.   iyon na.. xD 		"
Ano ang meron ang ating mundo na wala ang ibang planeta?,"dito nabubuhay ang mga tao at mga hayop  dito lng may hangin, may lupa, langit kaya dpat pang lagaan ang ating mundo iwasan ang mga polusyon.. na dulot ng mga sasakyan o iba pang mga komunikassyon...  ...writen by:charlotte c. capati 		"
